id,text,category,urgency
7254,Question: Features are not loading properly thanks,technical,medium
7255,can't update my payment method,billing,medium
7256,Help: Support for multiple languages ASAP,feature_request,high
7257,Urgent: Can't access my old account thanks,account,medium
7258,Question: Please add two-factor authentication urgently,feature_request,high
7259,Help: Payment failed but I see a pending charge!!!,billing,medium
7260,Support for multiple languages urgently,feature_request,high
7261,Account security concerns urgently,account,low
7262,Question: API documentation is needed ASAP,feature_request,high
7263,Urgent: Can you add dark mode,feature_request,low
7264,Urgent: Add calendar integration!!!,feature_request,low
7265,Help: Page keeps redirecting me ASAP,technical,low
7266,QUESTION: PLEASE ADD TWO-FACTOR AUTHENTICATION ASAP,feature_request,medium
7267,question: can't verify my email please help,account,low
7268,Urgent: Need bulk upload functionality ASAP,feature_request,low
7269,Help: Mobile app freezes constantly any update?,technical,medium
7270,I'd like to export my data as CSV,feature_request,low
7271,Question: Can't verify my email urgently,account,medium
7272,Help: I need a refund for last month thanks,billing,high
7273,ISSUE: PROFILE PICTURE UPLOAD FAILS THANKS,account,low
7274,Issue: Add webhook support!!!,feature_request,high
7275,Help: Annual plan pricing confusion please help,billing,low
7276,Question: Data sync is failing!!!,technical,high
7277,Question: Add webhook support ASAP,feature_request,high
7278,Question: Two-factor authentication issues thanks,account,high
7279,Need custom reporting features ASAP,feature_request,medium
7280,Help: Data sync is failing!!!,technical,high
7281,Urgent: Need bulk upload functionality please help,feature_request,medium
7282,Help: Data sync is failing please help,technical,low
7283,Help: How do I delete my account urgently,account,high
7284,Can't verify my email urgently,account,low
7285,Question: API documentation is needed any update?,feature_request,high
7286,Issue: Would like email notifications,feature_request,high
7287,PROFILE PICTURE UPLOAD FAILS,account,medium
7288,Can't verify my email thanks,account,medium
7289,urgent: need to change my username thanks,account,medium
7290,Question: I was charged twice for my subscription ASAP,billing,low
7291,Help: Account suspended notification,account,high
7292,Issue: Page keeps redirecting me ASAP,technical,high
7293,Question: Profile settings won't save thanks,account,low
7294,Issue: Need custom reporting features thanks,feature_request,low
7295,Help: The pricing doesn't match what I was quoted please help,billing,medium
7296,Help: Why was I charged for a feature I didn't use,billing,medium
7297,Urgent: Profile picture upload fails urgently,account,medium
7298,Urgent: I need a refund for last month thanks,billing,high
7299,Question: Profile settings won't save!!!,account,high
7300,Urgent: Two-factor authentication issues,account,low
7301,I was charged twice for my subscription,billing,medium
7302,I need a refund for last month!!!,billing,high
7303,Tax calculation seems incorrect on invoice urgently,billing,high
7304,issue: annual plan pricing confusion urgently,billing,high
7305,Urgent: Please add two-factor authentication!!!,feature_request,low
7306,Question: Downgrade billing didn't process correctly ASAP,billing,medium
7307,Help: Mobile app freezes constantly any update?,technical,medium
7308,Issue: Payment failed but I see a pending charge thanks,billing,medium
7309,Add webhook support any update?,feature_request,high
7310,help: add calendar integration urgently,feature_request,high
7311,Help: How do I delete my account any update?,account,medium
7312,help: i'd like to export my data as csv any update?,feature_request,low
7313,Help: Getting timeout errors,technical,high
7314,Urgent: Export to PDF fails every time please help,technical,high
7315,help: need to transfer account ownership asap,account,low
7316,Question: Can you add dark mode please help,feature_request,high
7317,Urgent: Incorrect invoice amount,billing,low
7318,Issue: Can't update my payment method,billing,medium
7319,Question: Incorrect invoice amount!!!,billing,high
7320,Issue: How do I delete my account ASAP,account,high
7321,HELP: I WAS CHARGED TWICE FOR MY SUBSCRIPTION ANY UPDATE?,billing,low
7322,Issue: Two-factor authentication issues ASAP,account,low
7323,Issue: Notifications aren't being sent urgently,technical,medium
7324,help: account suspended notification asap,account,medium
7325,Urgent: Double billing issue on my account ASAP,billing,medium
7326,Urgent: Annual plan pricing confusion ASAP,billing,medium
7327,Help: Dashboard won't load ASAP,technical,high
7328,Help: Double billing issue on my account please help,billing,medium
7329,Help: Proration charges seem wrong please help,billing,high
7330,Issue: Profile settings won't save please help,account,low
7331,Form submission returns error ASAP,technical,medium
7332,Help: Getting timeout errors please help,technical,medium
7333,Issue: Can't verify my email any update?,account,low
7334,I'd like to export my data as CSV,feature_request,medium
7335,Help: Mobile app freezes constantly,technical,high
7336,Question: Can't update my payment method thanks,billing,low
7337,Urgent: Ability to customize dashboard layout ASAP,feature_request,high
7338,API integration is broken ASAP,technical,low
7339,HELP: PLEASE ADD KEYBOARD SHORTCUTS ASAP,feature_request,high
7340,Help: My credit card was declined but I have funds any update?,billing,low
7341,Help: Annual plan pricing confusion any update?,billing,medium
7342,Urgent: Please add keyboard shortcuts urgently,feature_request,low
7343,Help: Ability to customize dashboard layout ASAP,feature_request,high
7344,Question: Need bulk upload functionality any update?,feature_request,high
7345,Issue: The pricing doesn't match what I was quoted urgently,billing,medium
7346,Help: Two-factor authentication issues any update?,account,low
7347,ISSUE: CAN YOU ADD DARK MODE,feature_request,low
7348,Urgent: Integration with Slack would be helpful ASAP,feature_request,high
7349,Issue: Why was I charged for a feature I didn't use please help,billing,low
7350,Urgent: Account suspended notification!!!,account,high
7351,Help: Add calendar integration!!!,feature_request,low
7352,Urgent: Support for multiple languages thanks,feature_request,medium
7353,Question: Mobile app for iOS please thanks,feature_request,low
7354,Issue: Need bulk upload functionality urgently,feature_request,low
7355,Need custom reporting features ASAP,feature_request,low
7356,Help: Profile settings won't save please help,account,low
7357,Urgent: The app keeps crashing on startup any update?,technical,low
7358,Tax calculation seems incorrect on invoice ASAP,billing,low
7359,Help: Proration charges seem wrong thanks,billing,medium
7360,Urgent: I need a refund for last month urgently,billing,low
7361,Issue: Export to PDF fails every time urgently,technical,low
7362,Issue: Downgrade billing didn't process correctly thanks,billing,high
7363,issue: data sync is failing thanks,technical,low
7364,ISSUE: ACCOUNT SUSPENDED NOTIFICATION PLEASE HELP,account,medium
7365,URGENT: NEED TO UPGRADE MY SUBSCRIPTION PLAN URGENTLY,billing,low
7366,QUESTION: CAN'T UPLOAD FILES ASAP,technical,high
7367,Export to PDF fails every time please help,technical,medium
7368,Question: My account was locked ASAP,account,low
7369,Urgent: Two-factor authentication issues!!!,account,low
7370,Issue: Need bulk upload functionality any update?,feature_request,low
7371,Urgent: Getting timeout errors ASAP,technical,medium
7372,Urgent: Can you add dark mode!!!,feature_request,high
7373,Urgent: Profile settings won't save!!!,account,medium
7374,Urgent: I was charged twice for my subscription ASAP,billing,low
7375,Please add keyboard shortcuts ASAP,feature_request,medium
7376,issue: i can't log into my account thanks,technical,high
7377,Urgent: My credit card was declined but I have funds ASAP,billing,low
7378,issue: api documentation is needed asap,feature_request,low
7379,Getting timeout errors!!!,technical,medium
7380,Question: Incorrect invoice amount ASAP,billing,medium
7381,I can't log into my account,technical,high
7382,Help: Getting timeout errors please help,technical,high
7383,Issue: I was charged twice for my subscription,billing,medium
7384,Issue: Profile picture upload fails!!!,account,high
7385,Help: Need better filtering options urgently,feature_request,medium
7386,Question: Add webhook support please help,feature_request,high
7387,I need to update my email address please help,account,medium
7388,Help: Can't verify my email thanks,account,medium
7389,Issue: I forgot my password,account,medium
7390,Profile picture upload fails please help,account,high
7391,HELP: NOTIFICATIONS AREN'T BEING SENT ASAP,technical,medium
7392,Issue: Need to transfer account ownership any update?,account,medium
7393,Urgent: Features are not loading properly any update?,technical,low
7394,Urgent: Integration with Slack would be helpful please help,feature_request,low
7395,Page keeps redirecting me any update?,technical,low
7396,Issue: Would like email notifications,feature_request,low
7397,Issue: Account security concerns,account,medium
7398,QUESTION: NEED CUSTOM REPORTING FEATURES PLEASE HELP,feature_request,low
7399,Help: Dashboard won't load any update?,technical,high
7400,Help: Ability to customize dashboard layout urgently,feature_request,medium
7401,My credit card was declined but I have funds any update?,billing,high
7402,Issue: Getting timeout errors any update?,technical,high
7403,Question: Page keeps redirecting me,technical,medium
7404,Payment failed but I see a pending charge please help,billing,low
7405,Question: Can you add dark mode thanks,feature_request,high
7406,Incorrect invoice amount,billing,high
7407,Urgent: Can you add dark mode thanks,feature_request,medium
7408,Urgent: Can't verify my email,account,high
7409,Issue: API documentation is needed ASAP,feature_request,high
7410,Question: Profile picture upload fails any update?,account,medium
7411,Urgent: I can't log into my account thanks,technical,low
7412,Support for multiple languages!!!,feature_request,low
7413,Help: My account was locked,account,high
7414,Issue: Why was I charged for a feature I didn't use thanks,billing,high
7415,Issue: Would like email notifications thanks,feature_request,low
7416,Question: The app keeps crashing on startup ASAP,technical,low
7417,Help: Dashboard won't load!!!,technical,medium
7418,Can you add dark mode please help,feature_request,medium
7419,Question: Two-factor authentication issues thanks,account,medium
7420,URGENT: CAN'T VERIFY MY EMAIL!!!,account,medium
7421,Help: Two-factor authentication issues any update?,account,high
7422,Help: Export to PDF fails every time ASAP,technical,high
7423,Help: Tax calculation seems incorrect on invoice!!!,billing,high
7424,ISSUE: NEED TO CHANGE MY USERNAME,account,medium
7425,Urgent: Profile picture upload fails thanks,account,low
7426,ISSUE: MY ACCOUNT WAS LOCKED URGENTLY,account,high
7427,NEED TO TRANSFER ACCOUNT OWNERSHIP THANKS,account,high
7428,Help: Can't access my old account please help,account,medium
7429,Help: Need to upgrade my subscription plan urgently,billing,high
7430,Issue: How do I add team members ASAP,account,medium
7431,Urgent: Add webhook support urgently,feature_request,low
7432,I can't log into my account!!!,technical,high
7433,Help: The pricing doesn't match what I was quoted thanks,billing,low
7434,Issue: Please add keyboard shortcuts,feature_request,high
7435,Issue: Need custom reporting features thanks,feature_request,high
7436,Can't access my old account thanks,account,low
7437,Question: API documentation is needed any update?,feature_request,medium
7438,Why was I charged for a feature I didn't use urgently,billing,low
7439,Can you add dark mode!!!,feature_request,high
7440,Issue: Need bulk upload functionality!!!,feature_request,high
7441,Urgent: Would like email notifications urgently,feature_request,low
7442,Help: Mobile app freezes constantly,technical,medium
7443,Urgent: Can't verify my email urgently,account,low
7444,Help: Can't upload files urgently,technical,high
7445,Help: Need to cancel my subscription!!!,billing,low
7446,Question: Why was I charged for a feature I didn't use any update?,billing,low
7447,Issue: How do I delete my account any update?,account,medium
7448,issue: annual plan pricing confusion thanks,billing,high
7449,Proration charges seem wrong urgently,billing,low
7450,Help: Incorrect invoice amount any update?,billing,medium
7451,ISSUE: HOW DO I ADD TEAM MEMBERS!!!,account,low
7452,Issue: Payment failed but I see a pending charge ASAP,billing,medium
7453,Help: Tax calculation seems incorrect on invoice please help,billing,medium
7454,Issue: Support for multiple languages any update?,feature_request,medium
7455,issue: can you add dark mode any update?,feature_request,medium
7456,Urgent: Page keeps redirecting me!!!,technical,medium
7457,QUESTION: ABILITY TO CUSTOMIZE DASHBOARD LAYOUT PLEASE HELP,feature_request,low
7458,Downgrade billing didn't process correctly any update?,billing,high
7459,Issue: My credit card was declined but I have funds urgently,billing,medium
7460,Help: API integration is broken!!!,technical,high
7461,mobile app for ios please please help,feature_request,low
7462,Help: I need a refund for last month ASAP,billing,low
7463,Help: Add calendar integration please help,feature_request,high
7464,Question: Can you add dark mode,feature_request,high
7465,urgent: how do i add team members please help,account,high
7466,Urgent: I was charged twice for my subscription urgently,billing,medium
7467,help: account suspended notification any update?,account,medium
7468,Help: Need custom reporting features thanks,feature_request,medium
7469,Question: Can't upload files thanks,technical,high
7470,QUESTION: I NEED A REFUND FOR LAST MONTH,billing,medium
7471,Question: Features are not loading properly thanks,technical,low
7472,Issue: Annual plan pricing confusion urgently,billing,high
7473,Issue: Need to transfer account ownership!!!,account,low
7474,HELP: GETTING TIMEOUT ERRORS THANKS,technical,low
7475,Help: API documentation is needed ASAP,feature_request,high
7476,Urgent: Ability to customize dashboard layout any update?,feature_request,medium
7477,Help: Need to cancel my subscription please help,billing,low
7478,Help: Need to upgrade my subscription plan please help,billing,medium
7479,issue: account security concerns thanks,account,medium
7480,Help: I need to update my email address ASAP,account,medium
7481,Help: Need to change my username ASAP,account,high
7482,Issue: Need to upgrade my subscription plan urgently,billing,high
7483,Question: How do I delete my account please help,account,low
7484,Urgent: The app keeps crashing on startup,technical,medium
7485,Urgent: Getting error code 500 when I try to save!!!,technical,low
7486,Question: I was charged twice for my subscription!!!,billing,high
7487,API INTEGRATION IS BROKEN PLEASE HELP,technical,medium
7488,Urgent: I was charged twice for my subscription thanks,billing,medium
7489,Help: Downgrade billing didn't process correctly,billing,high
7490,urgent: page keeps redirecting me urgently,technical,medium
7491,I'd like to export my data as CSV please help,feature_request,medium
7492,question: add webhook support urgently,feature_request,low
7493,Issue: Double billing issue on my account!!!,billing,high
7494,ISSUE: ADD WEBHOOK SUPPORT URGENTLY,feature_request,low
7495,ISSUE: MY ACCOUNT WAS LOCKED ASAP,account,medium
7496,Issue: Annual plan pricing confusion ASAP,billing,low
7497,QUESTION: INTEGRATION WITH SLACK WOULD BE HELPFUL URGENTLY,feature_request,low
7498,URGENT: CAN'T UPLOAD FILES ANY UPDATE?,technical,low
7499,Question: Account suspended notification!!!,account,medium
7500,ISSUE: INTEGRATION WITH SLACK WOULD BE HELPFUL PLEASE HELP,feature_request,medium
7501,Question: How do I delete my account,account,high
7502,Help: Why was I charged for a feature I didn't use,billing,low
7503,Help: Proration charges seem wrong any update?,billing,medium
7504,issue: i forgot my password please help,account,medium
7505,issue: double billing issue on my account any update?,billing,high
7506,Double billing issue on my account,billing,low
7507,Help: Would like email notifications ASAP,feature_request,high
7508,Question: The pricing doesn't match what I was quoted!!!,billing,low
7509,Help: Would like email notifications!!!,feature_request,high
7510,Urgent: I'd like to export my data as CSV urgently,feature_request,medium
7511,PLEASE ADD KEYBOARD SHORTCUTS URGENTLY,feature_request,low
7512,Help: I can't log into my account thanks,technical,low
7513,Help: Notifications aren't being sent please help,technical,low
7514,QUESTION: FEATURES ARE NOT LOADING PROPERLY!!!,technical,low
7515,Issue: Why was I charged for a feature I didn't use,billing,medium
7516,Profile picture upload fails!!!,account,high
7517,Question: How do I delete my account urgently,account,low
7518,Help: Support for multiple languages please help,feature_request,high
7519,Help: Profile picture upload fails urgently,account,high
7520,ISSUE: WOULD LIKE EMAIL NOTIFICATIONS,feature_request,low
7521,Help: Payment failed but I see a pending charge please help,billing,low
7522,Payment failed but I see a pending charge any update?,billing,low
7523,Question: The app keeps crashing on startup ASAP,technical,low
7524,Would like email notifications,feature_request,low
7525,Need bulk upload functionality thanks,feature_request,medium
7526,Urgent: Would like email notifications thanks,feature_request,high
7527,Help: Export to PDF fails every time!!!,technical,high
7528,Help: Page keeps redirecting me,technical,low
7529,Can't update my payment method thanks,billing,low
7530,Urgent: Can't upload files any update?,technical,medium
7531,Help: I'd like to export my data as CSV urgently,feature_request,medium
7532,Question: Can't verify my email thanks,account,high
7533,QUESTION: I NEED TO UPDATE MY EMAIL ADDRESS PLEASE HELP,account,medium
7534,HELP: TWO-FACTOR AUTHENTICATION ISSUES PLEASE HELP,account,medium
7535,Question: Search function not working urgently,technical,high
7536,The pricing doesn't match what I was quoted ASAP,billing,low
7537,help: page keeps redirecting me thanks,technical,medium
7538,Urgent: Why was I charged for a feature I didn't use ASAP,billing,medium
7539,Help: Features are not loading properly any update?,technical,medium
7540,Urgent: Page keeps redirecting me ASAP,technical,low
7541,HELP: THE APP KEEPS CRASHING ON STARTUP PLEASE HELP,technical,low
7542,Question: How do I add team members!!!,account,high
7543,Urgent: Would like email notifications ASAP,feature_request,low
7544,Issue: Profile settings won't save any update?,account,high
7545,Help: Getting timeout errors ASAP,technical,medium
7546,help: downgrade billing didn't process correctly,billing,low
7547,urgent: the pricing doesn't match what i was quoted,billing,medium
7548,Issue: Why was I charged for a feature I didn't use thanks,billing,low
7549,Issue: Please add keyboard shortcuts ASAP,feature_request,high
7550,Issue: I can't log into my account any update?,technical,medium
7551,Help: Can't update my payment method thanks,billing,high
7552,Data sync is failing any update?,technical,medium
7553,help: profile settings won't save!!!,account,low
7554,issue: api integration is broken,technical,medium
7555,Urgent: Can't verify my email!!!,account,medium
7556,Issue: API integration is broken thanks,technical,medium
7557,Add calendar integration any update?,feature_request,high
7558,Question: My account was locked any update?,account,high
7559,Urgent: I need a refund for last month any update?,billing,low
7560,Help: Please add keyboard shortcuts,feature_request,high
7561,Question: Data sync is failing urgently,technical,low
7562,Two-factor authentication issues thanks,account,medium
7563,Issue: Double billing issue on my account ASAP,billing,medium
7564,Urgent: How do I delete my account any update?,account,medium
7565,help: integration with slack would be helpful urgently,feature_request,low
7566,Question: Need to cancel my subscription thanks,billing,low
7567,Issue: I need to update my email address thanks,account,high
7568,Issue: Add webhook support,feature_request,high
7569,Issue: Proration charges seem wrong,billing,low
7570,question: can't upload files,technical,medium
7571,ISSUE: NEED TO MERGE DUPLICATE ACCOUNTS,account,medium
7572,Help: Can't access my old account,account,low
7573,Help: Features are not loading properly please help,technical,medium
7574,Issue: The pricing doesn't match what I was quoted please help,billing,low
7575,Issue: Form submission returns error urgently,technical,high
7576,URGENT: PLEASE ADD KEYBOARD SHORTCUTS ASAP,feature_request,low
7577,GETTING ERROR CODE 500 WHEN I TRY TO SAVE!!!,technical,medium
7578,urgent: proration charges seem wrong urgently,billing,high
7579,Help: Can you add dark mode any update?,feature_request,high
7580,Issue: Ability to customize dashboard layout,feature_request,medium
7581,Question: Getting timeout errors urgently,technical,low
7582,Help: Profile settings won't save ASAP,account,high
7583,Question: Ability to customize dashboard layout please help,feature_request,low
7584,Help: Need to upgrade my subscription plan please help,billing,low
7585,Urgent: Can't update my payment method urgently,billing,medium
7586,URGENT: MOBILE APP FREEZES CONSTANTLY!!!,technical,medium
7587,HELP: ABILITY TO CUSTOMIZE DASHBOARD LAYOUT!!!,feature_request,low
7588,Issue: Please add two-factor authentication,feature_request,high
7589,help: need better filtering options any update?,feature_request,high
7590,Urgent: Notifications aren't being sent ASAP,technical,low
7591,issue: can you add dark mode thanks,feature_request,medium
7592,Question: Add calendar integration ASAP,feature_request,low
7593,Urgent: Payment failed but I see a pending charge,billing,medium
7594,Question: Need to change my username urgently,account,medium
7595,ISSUE: I CAN'T LOG INTO MY ACCOUNT URGENTLY,technical,high
7596,PAYMENT FAILED BUT I SEE A PENDING CHARGE ANY UPDATE?,billing,low
7597,Help: API documentation is needed!!!,feature_request,high
7598,Annual plan pricing confusion,billing,high
7599,Question: Tax calculation seems incorrect on invoice urgently,billing,low
7600,Issue: Notifications aren't being sent any update?,technical,high
7601,Urgent: Can't update my payment method!!!,billing,high
7602,I need a refund for last month ASAP,billing,low
7603,Urgent: Account security concerns!!!,account,medium
7604,Getting timeout errors ASAP,technical,medium
7605,Question: Payment failed but I see a pending charge thanks,billing,high
7606,urgent: export to pdf fails every time thanks,technical,low
7607,Urgent: Features are not loading properly any update?,technical,high
7608,Question: Export to PDF fails every time please help,technical,high
7609,Can't access my old account ASAP,account,medium
7610,Help: Why was I charged for a feature I didn't use urgently,billing,low
7611,Mobile app freezes constantly ASAP,technical,low
7612,Question: Need custom reporting features any update?,feature_request,high
7613,Urgent: Need to change my username,account,low
7614,Issue: Need better filtering options,feature_request,low
7615,Help: Please add two-factor authentication please help,feature_request,low
7616,Issue: I can't log into my account any update?,technical,low
7617,QUESTION: DOWNGRADE BILLING DIDN'T PROCESS CORRECTLY ANY UPDATE?,billing,high
7618,Urgent: My account was locked thanks,account,medium
7619,Question: I'd like to export my data as CSV any update?,feature_request,medium
7620,Question: Please add two-factor authentication,feature_request,medium
7621,help: getting timeout errors please help,technical,high
7622,Can't update my payment method thanks,billing,medium
7623,My account was locked thanks,account,medium
7624,Help: API integration is broken any update?,technical,low
7625,Question: Search function not working please help,technical,medium
7626,urgent: two-factor authentication issues asap,account,medium
7627,Urgent: Can you add dark mode!!!,feature_request,high
7628,Question: Why was I charged for a feature I didn't use ASAP,billing,medium
7629,Urgent: Two-factor authentication issues,account,high
7630,Issue: Need custom reporting features,feature_request,low
7631,Question: Mobile app for iOS please,feature_request,low
7632,Issue: API documentation is needed urgently,feature_request,low
7633,Help: Profile picture upload fails urgently,account,high
7634,Question: My credit card was declined but I have funds!!!,billing,low
7635,Urgent: Getting error code 500 when I try to save ASAP,technical,high
7636,Issue: Can't verify my email any update?,account,high
7637,Urgent: I forgot my password,account,high
7638,Can't access my old account any update?,account,medium
7639,QUESTION: I'D LIKE TO EXPORT MY DATA AS CSV,feature_request,high
7640,Question: API integration is broken ASAP,technical,high
7641,Help: Ability to customize dashboard layout thanks,feature_request,low
7642,Urgent: The app keeps crashing on startup!!!,technical,low
7643,Issue: Tax calculation seems incorrect on invoice thanks,billing,high
7644,Can't update my payment method thanks,billing,high
7645,Tax calculation seems incorrect on invoice urgently,billing,high
7646,help: features are not loading properly!!!,technical,medium
7647,Tax calculation seems incorrect on invoice!!!,billing,low
7648,issue: can't upload files any update?,technical,high
7649,api integration is broken urgently,technical,high
7650,Urgent: Export to PDF fails every time please help,technical,low
7651,Urgent: My account was locked please help,account,high
7652,Help: Double billing issue on my account,billing,medium
7653,Question: Tax calculation seems incorrect on invoice please help,billing,low
