id,text,category,urgency
2429,Urgent: I need to update my email address thanks,account,high
2430,Question: Incorrect invoice amount urgently,billing,high
2431,Account security concerns thanks,account,high
2432,Urgent: Getting timeout errors ASAP,technical,low
2433,Question: I forgot my password,account,low
2434,QUESTION: PAYMENT FAILED BUT I SEE A PENDING CHARGE THANKS,billing,low
2435,Help: Tax calculation seems incorrect on invoice ASAP,billing,low
2436,help: can you add dark mode asap,feature_request,medium
2437,Help: Can you add dark mode any update?,feature_request,high
2438,Urgent: Account suspended notification!!!,account,low
2439,Urgent: Please add two-factor authentication ASAP,feature_request,high
2440,Question: I need a refund for last month urgently,billing,low
2441,Issue: Export to PDF fails every time,technical,low
2442,Need bulk upload functionality urgently,feature_request,low
2443,Issue: API integration is broken thanks,technical,low
2444,Issue: I need a refund for last month,billing,high
2445,Question: Need to cancel my subscription,billing,low
2446,I forgot my password,account,high
2447,Question: How do I delete my account,account,medium
2448,Can't upload files ASAP,technical,medium
2449,Urgent: Features are not loading properly thanks,technical,low
2450,QUESTION: THE APP KEEPS CRASHING ON STARTUP THANKS,technical,high
2451,Issue: Can you add dark mode thanks,feature_request,low
2452,Issue: Mobile app freezes constantly any update?,technical,high
2453,Help: Page keeps redirecting me ASAP,technical,high
2454,Help: Profile picture upload fails any update?,account,high
2455,question: i need a refund for last month urgently,billing,medium
2456,Profile settings won't save!!!,account,medium
2457,Urgent: Please add two-factor authentication!!!,feature_request,low
2458,The pricing doesn't match what I was quoted please help,billing,low
2459,Can't access my old account ASAP,account,medium
2460,Urgent: Downgrade billing didn't process correctly thanks,billing,low
2461,I need a refund for last month thanks,billing,medium
2462,Issue: Form submission returns error ASAP,technical,low
2463,Issue: Need to merge duplicate accounts thanks,account,low
2464,help: need better filtering options please help,feature_request,medium
2465,Can't upload files thanks,technical,high
2466,Question: Double billing issue on my account!!!,billing,medium
2467,Urgent: Account suspended notification thanks,account,medium
2468,URGENT: PROFILE SETTINGS WON'T SAVE!!!,account,high
2469,Payment failed but I see a pending charge ASAP,billing,high
2470,urgent: i forgot my password any update?,account,high
2471,Urgent: Double billing issue on my account!!!,billing,medium
2472,Urgent: How do I delete my account thanks,account,low
2473,Question: Downgrade billing didn't process correctly urgently,billing,medium
2474,FORM SUBMISSION RETURNS ERROR ANY UPDATE?,technical,low
2475,QUESTION: PAYMENT FAILED BUT I SEE A PENDING CHARGE THANKS,billing,high
2476,SEARCH FUNCTION NOT WORKING THANKS,technical,low
2477,please add keyboard shortcuts thanks,feature_request,high
2478,Would like email notifications any update?,feature_request,low
2479,URGENT: ACCOUNT SUSPENDED NOTIFICATION,account,medium
2480,urgent: need better filtering options asap,feature_request,medium
2481,Question: Profile picture upload fails please help,account,medium
2482,question: i forgot my password asap,account,medium
2483,QUESTION: WOULD LIKE EMAIL NOTIFICATIONS ASAP,feature_request,high
2484,please add keyboard shortcuts asap,feature_request,high
2485,Help: API documentation is needed thanks,feature_request,medium
2486,Issue: Please add keyboard shortcuts urgently,feature_request,medium
2487,Issue: Page keeps redirecting me!!!,technical,medium
2488,Help: Account suspended notification thanks,account,low
2489,Urgent: My account was locked!!!,account,high
2490,Question: The app keeps crashing on startup,technical,high
2491,Help: I'd like to export my data as CSV urgently,feature_request,medium
2492,Question: How do I add team members please help,account,low
2493,URGENT: FORM SUBMISSION RETURNS ERROR!!!,technical,low
2494,Question: The app keeps crashing on startup thanks,technical,high
2495,Help: Add webhook support any update?,feature_request,medium
2496,Help: Need to change my username thanks,account,low
2497,Urgent: Why was I charged for a feature I didn't use please help,billing,low
2498,can't verify my email please help,account,high
2499,How do I add team members ASAP,account,high
2500,Help: Would like email notifications thanks,feature_request,low
2501,Integration with Slack would be helpful thanks,feature_request,low
2502,Question: Export to PDF fails every time any update?,technical,medium
2503,How do I add team members thanks,account,low
2504,Urgent: Need better filtering options thanks,feature_request,high
2505,Question: The app keeps crashing on startup,technical,high
2506,Issue: Features are not loading properly thanks,technical,low
2507,Double billing issue on my account thanks,billing,medium
2508,issue: can't verify my email asap,account,medium
2509,Help: I need to update my email address any update?,account,low
2510,Question: Need to upgrade my subscription plan!!!,billing,medium
2511,Issue: API integration is broken!!!,technical,low
2512,Urgent: Data sync is failing!!!,technical,high
2513,question: need to transfer account ownership,account,low
2514,ISSUE: I WAS CHARGED TWICE FOR MY SUBSCRIPTION!!!,billing,high
2515,Question: Features are not loading properly thanks,technical,high
2516,My account was locked thanks,account,medium
2517,help: i can't log into my account thanks,technical,high
2518,Urgent: Proration charges seem wrong urgently,billing,medium
2519,Please add two-factor authentication ASAP,feature_request,low
2520,Question: Profile settings won't save urgently,account,high
2521,Urgent: Getting error code 500 when I try to save ASAP,technical,high
2522,HELP: NEED TO CANCEL MY SUBSCRIPTION,billing,medium
2523,Need to upgrade my subscription plan thanks,billing,medium
2524,Issue: Search function not working urgently,technical,high
2525,I forgot my password!!!,account,medium
2526,issue: please add two-factor authentication asap,feature_request,high
2527,Payment failed but I see a pending charge please help,billing,medium
2528,Issue: Incorrect invoice amount please help,billing,medium
2529,Issue: Double billing issue on my account urgently,billing,medium
2530,Question: Mobile app for iOS please ASAP,feature_request,medium
2531,Help: Payment failed but I see a pending charge ASAP,billing,low
2532,Issue: I forgot my password!!!,account,low
2533,Urgent: Page keeps redirecting me ASAP,technical,low
2534,urgent: why was i charged for a feature i didn't use thanks,billing,high
2535,Mobile app for iOS please urgently,feature_request,high
2536,API documentation is needed!!!,feature_request,medium
2537,Question: Two-factor authentication issues any update?,account,medium
2538,Issue: Can't upload files thanks,technical,high
2539,Issue: Can't update my payment method please help,billing,high
2540,Urgent: Export to PDF fails every time thanks,technical,low
2541,QUESTION: ANNUAL PLAN PRICING CONFUSION THANKS,billing,medium
2542,ISSUE: ACCOUNT SECURITY CONCERNS ANY UPDATE?,account,medium
2543,Urgent: Need better filtering options thanks,feature_request,high
2544,Question: How do I add team members!!!,account,high
2545,HELP: ADD WEBHOOK SUPPORT THANKS,feature_request,high
2546,Issue: Please add two-factor authentication any update?,feature_request,high
2547,Issue: Search function not working!!!,technical,medium
2548,Question: Need better filtering options any update?,feature_request,low
2549,Issue: The app keeps crashing on startup!!!,technical,high
2550,Urgent: My credit card was declined but I have funds ASAP,billing,low
2551,Question: Search function not working thanks,technical,high
2552,Question: Need to upgrade my subscription plan please help,billing,high
2553,Urgent: Need to merge duplicate accounts any update?,account,medium
2554,help: how do i add team members,account,low
2555,Help: Need custom reporting features,feature_request,medium
2556,issue: dashboard won't load please help,technical,high
2557,Question: Page keeps redirecting me ASAP,technical,high
2558,Help: Integration with Slack would be helpful!!!,feature_request,medium
2559,Help: Proration charges seem wrong any update?,billing,medium
2560,Account security concerns any update?,account,medium
2561,help: account security concerns any update?,account,high
2562,Question: Account suspended notification,account,low
2563,Help: My account was locked,account,low
2564,The pricing doesn't match what I was quoted ASAP,billing,high
2565,Help: Would like email notifications thanks,feature_request,high
2566,Help: Account security concerns please help,account,high
2567,Help: Account security concerns thanks,account,medium
2568,ADD CALENDAR INTEGRATION THANKS,feature_request,low
2569,Help: Can't verify my email,account,low
2570,Help: Account security concerns any update?,account,high
2571,Help: Annual plan pricing confusion thanks,billing,high
2572,Question: I forgot my password!!!,account,medium
2573,Issue: Mobile app for iOS please any update?,feature_request,low
2574,Question: Please add two-factor authentication ASAP,feature_request,medium
2575,Urgent: Can't verify my email!!!,account,medium
2576,Help: Can't upload files please help,technical,high
2577,Issue: Mobile app for iOS please!!!,feature_request,low
2578,urgent: payment failed but i see a pending charge any update?,billing,low
2579,urgent: need bulk upload functionality asap,feature_request,low
2580,Issue: Two-factor authentication issues thanks,account,low
2581,Question: Can't verify my email,account,low
2582,Urgent: How do I add team members any update?,account,high
2583,Urgent: Form submission returns error!!!,technical,medium
2584,Issue: Need to upgrade my subscription plan thanks,billing,low
2585,QUESTION: NEED CUSTOM REPORTING FEATURES ASAP,feature_request,medium
2586,page keeps redirecting me any update?,technical,high
2587,Help: Please add two-factor authentication please help,feature_request,medium
2588,Notifications aren't being sent!!!,technical,low
2589,Urgent: Please add keyboard shortcuts thanks,feature_request,low
2590,Help: Notifications aren't being sent!!!,technical,medium
2591,Double billing issue on my account please help,billing,low
2592,Urgent: How do I delete my account,account,high
2593,Urgent: Need better filtering options thanks,feature_request,low
2594,Help: I forgot my password ASAP,account,medium
2595,Export to PDF fails every time any update?,technical,high
2596,Question: API integration is broken!!!,technical,low
2597,question: i forgot my password!!!,account,high
2598,Urgent: Annual plan pricing confusion,billing,medium
2599,Help: Proration charges seem wrong thanks,billing,high
2600,ISSUE: PROFILE SETTINGS WON'T SAVE PLEASE HELP,account,low
2601,Help: Form submission returns error,technical,medium
2602,help: notifications aren't being sent urgently,technical,low
2603,Urgent: Need to transfer account ownership thanks,account,medium
2604,Question: Can't upload files please help,technical,medium
2605,Urgent: Mobile app freezes constantly,technical,medium
2606,Urgent: I need to update my email address,account,low
2607,Question: Two-factor authentication issues urgently,account,high
2608,PRORATION CHARGES SEEM WRONG!!!,billing,high
2609,Urgent: Can't upload files thanks,technical,medium
2610,Help: Account suspended notification urgently,account,high
2611,Urgent: How do I add team members,account,low
2612,Incorrect invoice amount thanks,billing,low
2613,Can't access my old account urgently,account,low
2614,Issue: Ability to customize dashboard layout,feature_request,high
2615,help: i was charged twice for my subscription urgently,billing,high
2616,My account was locked any update?,account,medium
2617,Urgent: Add calendar integration,feature_request,high
2618,Help: I need a refund for last month ASAP,billing,high
2619,Issue: Add calendar integration please help,feature_request,medium
2620,Issue: I need to update my email address ASAP,account,medium
2621,Question: The app keeps crashing on startup please help,technical,high
2622,Help: Why was I charged for a feature I didn't use!!!,billing,medium
2623,Can't access my old account,account,low
2624,Annual plan pricing confusion any update?,billing,high
2625,Urgent: Account security concerns please help,account,low
2626,Issue: Tax calculation seems incorrect on invoice,billing,medium
2627,HELP: PRORATION CHARGES SEEM WRONG PLEASE HELP,billing,medium
2628,Issue: Add webhook support any update?,feature_request,high
2629,Help: Getting timeout errors ASAP,technical,high
2630,URGENT: I FORGOT MY PASSWORD THANKS,account,medium
2631,Question: Why was I charged for a feature I didn't use please help,billing,high
2632,GETTING TIMEOUT ERRORS!!!,technical,high
2633,Question: Getting error code 500 when I try to save!!!,technical,low
2634,urgent: notifications aren't being sent urgently,technical,low
2635,Help: The app keeps crashing on startup thanks,technical,medium
2636,QUESTION: WHY WAS I CHARGED FOR A FEATURE I DIDN'T USE URGENTLY,billing,medium
2637,Question: Getting error code 500 when I try to save ASAP,technical,high
2638,Form submission returns error!!!,technical,medium
2639,HELP: PAGE KEEPS REDIRECTING ME ANY UPDATE?,technical,medium
2640,Help: Two-factor authentication issues please help,account,medium
2641,Urgent: My credit card was declined but I have funds please help,billing,high
2642,Issue: I was charged twice for my subscription thanks,billing,medium
2643,Question: Can't verify my email thanks,account,medium
2644,Question: Can't update my payment method!!!,billing,high
2645,ISSUE: API DOCUMENTATION IS NEEDED!!!,feature_request,medium
2646,Help: Double billing issue on my account,billing,low
2647,Question: Proration charges seem wrong,billing,low
2648,Help: Account suspended notification thanks,account,low
2649,Help: Double billing issue on my account,billing,medium
2650,Urgent: Two-factor authentication issues thanks,account,high
2651,ISSUE: ACCOUNT SECURITY CONCERNS!!!,account,low
2652,GETTING TIMEOUT ERRORS URGENTLY,technical,medium
2653,Need to upgrade my subscription plan thanks,billing,high
2654,Help: Profile settings won't save,account,medium
2655,Issue: Proration charges seem wrong,billing,medium
2656,Mobile app freezes constantly ASAP,technical,high
2657,urgent: please add two-factor authentication any update?,feature_request,high
2658,Issue: Account suspended notification thanks,account,medium
2659,issue: account suspended notification asap,account,low
2660,annual plan pricing confusion please help,billing,medium
2661,URGENT: NEED TO TRANSFER ACCOUNT OWNERSHIP URGENTLY,account,medium
2662,Question: Annual plan pricing confusion thanks,billing,medium
2663,urgent: export to pdf fails every time any update?,technical,medium
2664,Urgent: Search function not working urgently,technical,low
2665,Urgent: I need a refund for last month,billing,low
2666,Question: Need bulk upload functionality please help,feature_request,high
2667,QUESTION: DATA SYNC IS FAILING ANY UPDATE?,technical,low
2668,Issue: Proration charges seem wrong!!!,billing,medium
2669,Question: Proration charges seem wrong thanks,billing,low
2670,Urgent: Need to change my username!!!,account,low
2671,Help: Double billing issue on my account any update?,billing,high
2672,Help: Mobile app freezes constantly ASAP,technical,high
2673,HELP: NEED TO CHANGE MY USERNAME ANY UPDATE?,account,medium
2674,Issue: Payment failed but I see a pending charge urgently,billing,medium
2675,Issue: My credit card was declined but I have funds,billing,high
2676,Need to merge duplicate accounts urgently,account,medium
2677,question: how do i delete my account urgently,account,high
2678,Question: Would like email notifications urgently,feature_request,low
2679,Question: I was charged twice for my subscription ASAP,billing,medium
2680,Issue: Can't access my old account please help,account,low
2681,Urgent: Can't access my old account,account,high
2682,API documentation is needed ASAP,feature_request,high
2683,ISSUE: HOW DO I DELETE MY ACCOUNT PLEASE HELP,account,low
2684,URGENT: MY CREDIT CARD WAS DECLINED BUT I HAVE FUNDS PLEASE HELP,billing,medium
2685,Question: API documentation is needed please help,feature_request,high
2686,Question: I forgot my password urgently,account,high
2687,QUESTION: DOWNGRADE BILLING DIDN'T PROCESS CORRECTLY PLEASE HELP,billing,high
2688,Question: API integration is broken thanks,technical,low
2689,Issue: Incorrect invoice amount!!!,billing,high
2690,Question: Need to change my username,account,medium
2691,Help: Getting error code 500 when I try to save urgently,technical,medium
2692,My account was locked ASAP,account,low
2693,HELP: PLEASE ADD TWO-FACTOR AUTHENTICATION,feature_request,high
2694,QUESTION: FEATURES ARE NOT LOADING PROPERLY THANKS,technical,medium
2695,Question: I need to update my email address thanks,account,medium
2696,Incorrect invoice amount ASAP,billing,high
2697,Downgrade billing didn't process correctly,billing,low
2698,Issue: Need to merge duplicate accounts ASAP,account,low
2699,Issue: I need a refund for last month urgently,billing,high
2700,Help: Form submission returns error urgently,technical,high
2701,I'd like to export my data as CSV urgently,feature_request,medium
2702,help: data sync is failing any update?,technical,high
2703,Issue: Getting error code 500 when I try to save thanks,technical,medium
2704,Issue: Mobile app for iOS please any update?,feature_request,medium
2705,Help: Form submission returns error,technical,high
2706,Urgent: Add webhook support ASAP,feature_request,medium
2707,Support for multiple languages any update?,feature_request,low
2708,Issue: Ability to customize dashboard layout!!!,feature_request,medium
2709,Issue: Need to merge duplicate accounts any update?,account,high
2710,Issue: Mobile app freezes constantly!!!,technical,medium
2711,Urgent: Getting timeout errors thanks,technical,low
2712,Issue: Features are not loading properly any update?,technical,low
2713,ISSUE: PAGE KEEPS REDIRECTING ME ASAP,technical,low
2714,PAYMENT FAILED BUT I SEE A PENDING CHARGE THANKS,billing,medium
2715,Issue: Please add keyboard shortcuts,feature_request,medium
2716,Help: Add calendar integration ASAP,feature_request,medium
2717,Help: Features are not loading properly,technical,medium
2718,Urgent: Form submission returns error any update?,technical,low
2719,I'd like to export my data as CSV any update?,feature_request,medium
2720,Question: Payment failed but I see a pending charge any update?,billing,medium
2721,Question: Need to upgrade my subscription plan any update?,billing,low
2722,Ability to customize dashboard layout please help,feature_request,medium
2723,Issue: I forgot my password please help,account,high
2724,Issue: Downgrade billing didn't process correctly please help,billing,low
2725,issue: ability to customize dashboard layout please help,feature_request,high
2726,Urgent: Need to cancel my subscription thanks,billing,high
2727,Question: Need to change my username any update?,account,medium
2728,Urgent: Notifications aren't being sent,technical,high
2729,Urgent: Notifications aren't being sent urgently,technical,high
2730,URGENT: NEED TO MERGE DUPLICATE ACCOUNTS PLEASE HELP,account,medium
2731,Urgent: Payment failed but I see a pending charge!!!,billing,low
2732,Issue: I was charged twice for my subscription!!!,billing,high
2733,Urgent: Need to transfer account ownership thanks,account,high
2734,I need to update my email address,account,low
2735,Issue: Mobile app freezes constantly please help,technical,medium
2736,How do I delete my account thanks,account,high
2737,I need a refund for last month ASAP,billing,high
2738,Question: Page keeps redirecting me,technical,medium
2739,Urgent: How do I delete my account,account,medium
2740,Urgent: Please add two-factor authentication urgently,feature_request,medium
2741,Help: I'd like to export my data as CSV!!!,feature_request,low
2742,Issue: Can't access my old account!!!,account,medium
2743,Help: Why was I charged for a feature I didn't use ASAP,billing,medium
2744,Question: Why was I charged for a feature I didn't use ASAP,billing,medium
2745,Issue: Mobile app for iOS please!!!,feature_request,high
2746,Question: Need bulk upload functionality thanks,feature_request,high
2747,I NEED A REFUND FOR LAST MONTH ANY UPDATE?,billing,medium
2748,Issue: Please add two-factor authentication thanks,feature_request,medium
2749,help: my account was locked,account,high
2750,HELP: NEED CUSTOM REPORTING FEATURES ASAP,feature_request,medium
2751,Help: Need to upgrade my subscription plan,billing,high
2752,Issue: Please add keyboard shortcuts ASAP,feature_request,medium
2753,Help: API documentation is needed please help,feature_request,high
2754,page keeps redirecting me any update?,technical,low
2755,Issue: Support for multiple languages any update?,feature_request,medium
2756,MOBILE APP FREEZES CONSTANTLY THANKS,technical,medium
2757,Urgent: I was charged twice for my subscription urgently,billing,high
2758,Urgent: Can't update my payment method urgently,billing,medium
2759,Urgent: I need to update my email address urgently,account,low
2760,Issue: Can't update my payment method urgently,billing,high
2761,Question: Page keeps redirecting me please help,technical,medium
2762,Issue: Downgrade billing didn't process correctly any update?,billing,medium
2763,Notifications aren't being sent urgently,technical,medium
2764,HELP: NEED TO UPGRADE MY SUBSCRIPTION PLAN THANKS,billing,medium
2765,need better filtering options thanks,feature_request,high
2766,My credit card was declined but I have funds,billing,low
2767,Add calendar integration urgently,feature_request,low
2768,Help: I'd like to export my data as CSV,feature_request,medium
2769,Question: Can you add dark mode thanks,feature_request,high
2770,urgent: add webhook support asap,feature_request,high
2771,Question: Integration with Slack would be helpful any update?,feature_request,high
2772,PROFILE PICTURE UPLOAD FAILS ANY UPDATE?,account,high
2773,Issue: Need to transfer account ownership,account,low
2774,issue: downgrade billing didn't process correctly thanks,billing,low
2775,Issue: Profile settings won't save!!!,account,low
2776,urgent: account suspended notification!!!,account,low
2777,Issue: Dashboard won't load any update?,technical,medium
2778,Can't upload files ASAP,technical,high
2779,Question: Can't upload files,technical,high
2780,URGENT: API INTEGRATION IS BROKEN!!!,technical,low
2781,notifications aren't being sent thanks,technical,low
2782,Issue: Need to transfer account ownership,account,medium
2783,Help: API integration is broken please help,technical,high
2784,URGENT: PAYMENT FAILED BUT I SEE A PENDING CHARGE PLEASE HELP,billing,low
2785,Question: Profile picture upload fails!!!,account,low
2786,Help: I was charged twice for my subscription any update?,billing,medium
2787,Proration charges seem wrong urgently,billing,high
2788,Question: Page keeps redirecting me ASAP,technical,medium
2789,Urgent: Profile picture upload fails urgently,account,high
2790,Help: Please add keyboard shortcuts urgently,feature_request,low
2791,Urgent: Form submission returns error please help,technical,medium
2792,Issue: Please add two-factor authentication please help,feature_request,low
2793,Need to cancel my subscription thanks,billing,medium
2794,Issue: Please add two-factor authentication any update?,feature_request,high
2795,Help: API documentation is needed please help,feature_request,medium
2796,QUESTION: HOW DO I DELETE MY ACCOUNT,account,high
2797,Urgent: How do I delete my account please help,account,high
2798,My account was locked,account,medium
2799,Form submission returns error ASAP,technical,high
2800,Issue: Mobile app freezes constantly!!!,technical,high
2801,Issue: Please add two-factor authentication,feature_request,low
2802,ISSUE: WOULD LIKE EMAIL NOTIFICATIONS THANKS,feature_request,medium
2803,Question: Need better filtering options any update?,feature_request,medium
2804,Issue: Add calendar integration urgently,feature_request,low
2805,Question: Mobile app for iOS please urgently,feature_request,low
2806,Issue: I forgot my password thanks,account,high
2807,Issue: Profile settings won't save any update?,account,medium
2808,HELP: PROFILE SETTINGS WON'T SAVE!!!,account,high
2809,HELP: FORM SUBMISSION RETURNS ERROR ASAP,technical,high
2810,Issue: Need to cancel my subscription ASAP,billing,high
2811,Need to transfer account ownership!!!,account,high
2812,Urgent: Export to PDF fails every time please help,technical,low
2813,Issue: My account was locked ASAP,account,high
2814,Question: Integration with Slack would be helpful ASAP,feature_request,high
2815,Question: How do I add team members!!!,account,high
2816,Urgent: Can't upload files thanks,technical,high
2817,Help: Mobile app for iOS please please help,feature_request,high
2818,ISSUE: ADD CALENDAR INTEGRATION,feature_request,medium
2819,Help: Form submission returns error ASAP,technical,high
2820,Issue: I need to update my email address any update?,account,high
2821,Issue: Please add two-factor authentication!!!,feature_request,low
2822,Need to cancel my subscription urgently,billing,high
2823,Would like email notifications,feature_request,medium
2824,Question: Proration charges seem wrong please help,billing,low
2825,Can you add dark mode urgently,feature_request,high
2826,QUESTION: SEARCH FUNCTION NOT WORKING THANKS,technical,high
2827,Issue: I forgot my password urgently,account,high
2828,URGENT: ADD WEBHOOK SUPPORT!!!,feature_request,low
2829,Urgent: Need to upgrade my subscription plan ASAP,billing,high
2830,Urgent: Please add two-factor authentication ASAP,feature_request,high
2831,Help: Need to change my username ASAP,account,medium
